{
  "id": "ev_conformance_001",
  "kind": "tool_result",
  "uri": "oacs://tools/tool_external_search/results/ev_conformance_001",
  "content_hash": "sha256:example-tool-result-payload",
  "sensitive": false,
  "public_payload": {
    "tool_id": "tool_external_search",
    "tool_name": "External Search",
    "tool_type": "external",
    "input_hash": "sha256:example-input",
    "output": {
      "answer": "Project Alpha reports are generated with make report-safe."
    },
    "attribution": {
      "source_actor_id": "tool_external_search",
      "source_actor_type": "tool",
      "recorded_by_actor_id": "act_agent_001",
      "role": "tool_observation",
      "confidence": 1.0
    },
    "source_uri": "repo://conformance/project-alpha-report"
  }
}
